{
  "hypothesis_id": "ch_20260406_001",
  "claim": {
    "cause": "active_instances",
    "effect": "cpu_util",
    "direction": "decrease",
    "magnitude": 0.12,
    "time_to_effect_s": 180
  },
  "scope": {
    "domain": "infra_ops",
    "env": "prod",
    "time_window": "2026Q2",
    "risk_level": "medium"
  },
  "confidence": 0.74,
  "evidence": [
    {
      "type": "tool_callback_hash",
      "source_id": "deploy_callback_991",
      "hash": "sha256:9dbbd4f0b35",
      "timestamp": "2026-04-06T10:21:00Z"
    }
  ],
  "falsifier": {
    "condition": "cpu_util_increase_gt_0.1_within_300s",
    "window_s": 300,
    "abort_action": "rollback"
  },
  "proposer": {
    "unit_id": "ua_scheduler_01",
    "model": "reason.llm",
    "version": "v1.4.2"
  },
  "base_world_version": "wm_v_1217"
}
